{
  "format": "xml-mapping",
  "namespaces": {
    "default": "http://apply.grants.gov/forms/NSF_KeyPersonExpanded_3_3-V3.3",
    "NSF_KeyPersonExpanded_3_3": "http://apply.grants.gov/forms/NSF_KeyPersonExpanded_3_3-V3.3",
    "globLib": "http://apply.grants.gov/system/GlobalLibrary-V2.0",
    "codes": "http://apply.grants.gov/system/UniversalCodes-V2.0",
    "glob": "http://apply.grants.gov/system/Global-V1.0",
    "att": "http://apply.grants.gov/system/Attachments-V1.0"
  },
  "xsd_url": "https://apply07.grants.gov/apply/forms/schemas/NSF_KeyPersonExpanded_3_3-V3.3.xsd",
  "root": {
    "NSF_KeyPersonExpanded_3_3": {
      "@NSF_KeyPersonExpanded_3_3:FormVersion": {
        "$const": "3.3"
      },
      "PDPI": {
        "Profile": {
          "Name": {
            "globLib:PrefixName": {
              "$field": "principal_investigator.name.prefix"
            },
            "globLib:FirstName": {
              "$field": "principal_investigator.name.first_name"
            },
            "globLib:MiddleName": {
              "$field": "principal_investigator.name.middle_name"
            },
            "globLib:LastName": {
              "$field": "principal_investigator.name.last_name"
            },
            "globLib:SuffixName": {
              "$field": "principal_investigator.name.suffix"
            }
          },
          "Title": {
            "$field": "principal_investigator.title"
          },
          "Address": {
            "globLib:Street1": {
              "$field": "principal_investigator.address.street1"
            },
            "globLib:Street2": {
              "$field": "principal_investigator.address.street2"
            },
            "globLib:City": {
              "$field": "principal_investigator.address.city"
            },
            "globLib:County": {
              "$field": "principal_investigator.address.county"
            },
            "globLib:State": {
              "$field": "principal_investigator.address.state"
            },
            "globLib:Province": {
              "$field": "principal_investigator.address.province"
            },
            "globLib:ZipPostalCode": {
              "$field": "principal_investigator.address.zip_code"
            },
            "globLib:Country": {
              "$field": "principal_investigator.address.country"
            }
          },
          "Phone": {
            "$field": "principal_investigator.phone"
          },
          "Fax": {
            "$field": "principal_investigator.fax"
          },
          "Email": {
            "$field": "principal_investigator.email"
          },
          "OrganizationName": {
            "$field": "principal_investigator.organization_name"
          },
          "Department": {
            "$field": "principal_investigator.department"
          },
          "Division": {
            "$field": "principal_investigator.division"
          },
          "ProjectRole": {
            "$field": "principal_investigator.project_role"
          },
          "NSFID": {
            "$field": "principal_investigator.nsf_id"
          },
          "BioSketchsAttached": {
            "BioSketchAttached": {
              "$attachment": "principal_investigator.biographical_sketch"
            }
          },
          "SupportsAttached": {
            "SupportAttached": {
              "$attachment": "principal_investigator.current_pending_support"
            }
          },
          "CollaboratorsAttached": {
            "CollaboratorAttached": {
              "$attachment": "principal_investigator.collaborators"
            }
          },
          "SynergisticActivitiesAttached": {
            "SynergisticAttached": {
              "$attachment": "principal_investigator.synergistic_activities"
            }
          }
        }
      },
      "KeyPerson": {
        "$each": {
          "items": {
            "$field": "senior_key_persons"
          },
          "map": {
            "Profile": {
              "Name": {
                "globLib:PrefixName": {
                  "$field": "name.prefix"
                },
                "globLib:FirstName": {
                  "$field": "name.first_name"
                },
                "globLib:MiddleName": {
                  "$field": "name.middle_name"
                },
                "globLib:LastName": {
                  "$field": "name.last_name"
                },
                "globLib:SuffixName": {
                  "$field": "name.suffix"
                }
              },
              "Title": {
                "$field": "title"
              },
              "Address": {
                "globLib:Street1": {
                  "$field": "address.street1"
                },
                "globLib:Street2": {
                  "$field": "address.street2"
                },
                "globLib:City": {
                  "$field": "address.city"
                },
                "globLib:County": {
                  "$field": "address.county"
                },
                "globLib:State": {
                  "$field": "address.state"
                },
                "globLib:Province": {
                  "$field": "address.province"
                },
                "globLib:ZipPostalCode": {
                  "$field": "address.zip_code"
                },
                "globLib:Country": {
                  "$field": "address.country"
                }
              },
              "Phone": {
                "$field": "phone"
              },
              "Fax": {
                "$field": "fax"
              },
              "Email": {
                "$field": "email"
              },
              "OrganizationUEIID": {
                "$field": "organization_uei"
              },
              "Department": {
                "$field": "department"
              },
              "Division": {
                "$field": "division"
              },
              "ProjectRole": {
                "$field": "project_role"
              },
              "NSFID": {
                "$field": "nsf_id"
              },
              "BioSketchsAttached": {
                "BioSketchAttached": {
                  "$attachment": "biographical_sketch"
                }
              },
              "SupportsAttached": {
                "SupportAttached": {
                  "$attachment": "current_pending_support"
                }
              },
              "CollaboratorsAttached": {
                "CollaboratorAttached": {
                  "$attachment": "collaborators"
                }
              },
              "SynergisticActivitiesAttached": {
                "SynergisticAttached": {
                  "$attachment": "synergistic_activities"
                }
              }
            }
          }
        }
      },
      "AdditionalProfilesAttached": {
        "AdditionalProfileAttached": {
          "$attachment": "additional_profiles"
        }
      },
      "BioSketchsAttached": {
        "BioSketchAttached": {
          "$attachment": "additional_biographical_sketches"
        }
      },
      "SupportsAttached": {
        "SupportAttached": {
          "$attachment": "additional_current_pending_support"
        }
      },
      "CollaboratorsAttached": {
        "CollaboratorAttached": {
          "$attachment": "additional_collaborators"
        }
      },
      "SynergisticActivitiesAttached": {
        "SynergisticAttached": {
          "$attachment": "additional_synergistic_activities"
        }
      }
    }
  }
}
